{
  "id": "design-unc-v1",
  "revision": 1,
  "modelId": "V1-plane-impulse",
  "ballSpecId": "type2-nominal",
  "surfaceId": "court-flat-design",
  "supportedConditions": [
    "design intent only; no validated ball-surface-state combination"
  ],
  "vrefMS": 10,
  "normalResponse": {
    "kind": "Constant",
    "en0": 0.74,
    "a0": 0,
    "a1": 0,
    "a2": 0
  },
  "frictionResponse": {
    "kind": "Constant",
    "mu0": 0.1724,
    "muMax": 2,
    "b0": 0,
    "b1": 0
  },
  "tangentialResponse": {
    "kind": "Zero",
    "beta": 0,
    "c0": 0
  },
  "domain": null,
  "table": null,
  "evidence": "ASSUMED_PRIOR",
  "calibrationStatus": "UNCALIBRATED",
  "validationStatus": "NOT_RUN",
  "release": "DEV_ONLY",
  "sourceDatasetHash": "",
  "calibrationRunId": "",
  "notes": "M1 design profile: constant en, constant mu, beta=0. Not fitted to any measured impact and not surface specific.",
  "parameters": [
    {
      "parameter": "en",
      "status": "FIXED",
      "value": 0.74,
      "standardError": null,
      "bootstrapLow": null,
      "bootstrapHigh": null,
      "atBoundary": false
    },
    {
      "parameter": "mu_eff",
      "status": "FIXED",
      "value": 0.1724,
      "standardError": null,
      "bootstrapLow": null,
      "bootstrapHigh": null,
      "atBoundary": false
    },
    {
      "parameter": "beta_grip",
      "status": "FIXED",
      "value": 0,
      "standardError": null,
      "bootstrapLow": null,
      "bootstrapHigh": null,
      "atBoundary": false
    }
  ]
}